index,artist,song,lyrics
335,Niall Horan,Slow Hands,"
We should take this back to my place
That's what she said right to my face
'Cause I want you bad
Yeah, I want you, baby
I've been thinkin' 'bout it all day
And I hope you feel the same way, yeah
'Cause I want you bad
Yeah, I want you, baby


Slow, slow hands
Like sweat drippin' down our dirty laundry
No, no chance
That I'm leavin' here without you on me
I, I know
Yeah, I already know that there ain't no stoppin'
Your plans and those
Slow hands (woo)
Slow hands


I just wanna take my time
We could do this, baby, all night, yeah
'Cause I want you bad
Yeah, I want you, baby


Slow, slow hands
Like sweat drippin' down our dirty laundry
No, no chance
That I'm leavin' here without you on me
I, I know
Yeah, I already know that there ain't no stoppin'
Your plans and those
Slow hands (woo)


Fingertips puttin' on a show
Got me now and I can't say no
Wanna be with you all alone
Take me home, take me home
Fingertips puttin' on a show
Can't you tell that I want you, baby, yeah


Slow, slow hands
Like sweat drippin' down our dirty laundry
No, no chance
That I'm leavin' here without you on me
I, I know
Yeah, I already know that there ain't no stoppin'
Slow, slow hands
Like sweat drippin' down our dirty laundry
No, no chance
That I'm leavin' here without you on me
I, I know
Yeah, I already know that there ain't no stoppin'
Your plans and those
Slow hands (woo)
Slow hands
Woo, slow hands"
336,The Weeknd & Daft Punk,Starboy,"
I'm tryna put you in the worst mood, ah
P1 cleaner than your church shoes, ah
Milli point two just to hurt you, ah
All red Lamb’ just to tease you, ah
None of these toys on lease too, ah
Made your whole year in a week too, yah
Main bitch out your league too, ah
Side bitch out of your league too, ah


House so empty, need a centerpiece
20 racks a table cut from ebony
Cut that ivory into skinny pieces
Then she clean it with her face man I love my baby
You talking money, need a hearing aid
You talking bout me, I don't see the shade
Switch up my style, I take any lane
I switch up my cup, I kill any pain


Look what you've done
I’m a motherfuckin' starboy
Look what you've done
I'm a motherfuckin' starboy


Every day a nigga try to test me, ah
Every day a nigga try to end me, ah
Pull off in that Roadster SV, ah
Pockets overweight, gettin' hefty, ah
Coming for the king, that's a far cry, ah
I come alive in the fall time, I
No competition, I don't really listen
I’m in the blue Mulsanne bumping New Edition


House so empty, need a centerpiece
20 racks a table cut from ebony
Cut that ivory into skinny pieces
Then she clean it with her face man I love my baby
You talking money, need a hearing aid
You talking bout me, I don’t see the shade
Switch up my style, I take any lane
I switch up my cup, I kill any pain


Look what you've done
I’m a motherfuckin' starboy
Look what you've done
I'm a motherfuckin’ starboy


Let a nigga brag Pitt
Legend of the fall took the year like a bandit
Bought mama a crib and a brand new wagon
Now she hit the grocery shop looking lavish
Star Trek roof in that Wraith of Khan
Girls get loose when they hear this song
100 on the dash get me close to God
We don't pray for love, we just pray for cars


House so empty, need a centerpiece
20 racks a table cut from ebony
Cut that ivory into skinny pieces
Then she clean it with her face man I love my baby
You talking money, need a hearing aid
You talking 'bout me, I don't see the shade
Switch up my style, I take any lane
I switch up my cup, I kill any pain


Look what you've done
I'm a motherfuckin' starboy
Look what you've done
I'm a motherfuckin' starboy
Look what you've done
I'm a motherfuckin' starboy
Look what you've done
I'm a motherfuckin' starboy"
337,Cardi B,Bodak Yellow (Money Moves),"Young Dumb & Broke by Khalid


Young dumb
Young, young dumb and broke
Young dumb
Young, young dumb and broke
Young dumb
Young, young dumb and broke
Young dumb broke high school kids

Bank Account by 21 Savage


I buy a new car for the chick (for real)
I tear down the mall with the chick (for real)
You can't even talk with a chick (no)
Yeah you know she lovin the kid (on God)
I pull up in 'Rari's and dip
With choppers and Harley's and shit (for real)
I be Gucci'd down
You wearing Lacoste and shit, ooh
Moncler, yuh, fur came off a bear
Triple overtime, put me in a chair, yeah
Triple cross the plug, we do not play fair
Got 'em tennis chains on and they real bling


I got 1-2-3-4-5-6-7-8 M's in my bank account
In my bank account
In my bank account
In my bank account
In my bank account
One more time, say
I got 1-2-3-4-5-6-7-8 shooters ready to rain down
Ready to rain down
Ready to rain down
Ready to rain down
Ready to rain you down

Bodak Yellow by Cardi B


Said, ""Lil chick, you can't get with me if you wanted to""
These expensive, these is red bottoms, these is bloody shoes
Hit the store, I can get 'em both, I don't wanna choose
And I'm quick, cut a heater off, so don't get comfortable, yeah
See I don't dance now, I make money moves
Say we don't dance now, we make money moves
If I see you and I don't speak, that means I don't mess with you
I'm a boss, you a worker, kid, I make bloody moves like


Yadadadadadadada
Yadadadadadada
Yadadadadadadada
Young dumb broke high school kids

Mixed


Cause we're young dumb
Young, young dumb and broke
Young dumb
Young, young dumb and broke
Young dumb
Young, young dumb and broke
Young dumb broke high school kids


Yadadadadadadada
Yadadadadadada
Yadadadadadadada
I got 1-2-3-4-5-6-7-8 M's in my bank account
In my bank account
Wooah..
Young dumb broke high school kids


Said, ""Lil kid, you can't mess with me, if you wanted to
These expensive, these is red bottoms, these is bloody shoes
Cause I don't dance now, I make money moves
Cause we don't dance now, we make money moves"
338,"Calvin Harris, Pharrell Williams, Katy Perry & Big Sean",Feels,"
Hey!
Well nothing ever last forever, no
One minute you're here and the next you're gone
So I respect you, wanna take it slow
I need a mental receipt to know this moment I owe


Do you mind if I steal a kiss? (Chop, chop)
A little souvenir, can I steal it from you?
To memorize the way you shock me
The way you move it here (Hey)
Just wanna feel it from you (Hey)


Don't be afraid to catch feels
Ride drop top and chase thrills (Hey)
I know you ain't afraid to pop pills (Hey)
Baby, I know you ain't scared to catch feels
Feels with me


I'm your window shopper, sucker for your love, oh
I'm wearing your goggles, virtual reality
It ain't what it cost you, it might be a dollar
As long as it shocks you, memory, electricity


Do you mind if I steal a kiss? (Chop, chop)
A little souvenir, can I steal it from you? (Oh, yeah)
To memorize the way you shock me (Zap)
The way you move it here (Hey)
Just wanna feel it from you (Hey)


Don't be afraid to catch feels (Ha)
Ride drop top and chase thrills (Oh-oh-oh, oh)
I know you ain't afraid to pop pills (Hey)
Baby, I know you ain't scared to catch feels (Straight up)
Feels with me (Woah)


Goddamn, I know you love to make an entrance
Do you like getting paid or getting paid attention?
You mixed the wrong guys with the right intentions
In the same bed, but it still feel long distance
She's looking for a little more consistency
But when you stop looking you gon' find what's meant to be
And honestly, I'm way too done with the hoes
I cut off all my exes for your x and o's
I feel my old flings was just preparing me
When I say I want you, say it back, parakeet
Fly in first-class through the air, Airbnb
I'm the best you had, you just be comparing me to me
I'ma 'at' this at you, if I put you on my phone
And upload it, it'll get maximum views
I came through in the clutch with the lipsticks and phones
Wear your fave cologne just to get you alone


Don't be afraid to catch feels
Don't be afraid to catch these feels
Ride drop top and chase thrills (Yeah)
I know you ain't afraid to pop pills (I know)
Baby, I know you ain't scared to catch feels
Woah, woah, woah
Feels with me
Don't be afraid to catch feels (No, no)
Don't be afraid, baby
Ride drop top and chase thrills (Woah, okay)
I know you ain't afraid to pop pills
I know, I know, I know, I know
Baby, I know you ain't scared to catch feels
Feels with me"
339,"Logic, Alessia Cara & Khalid",1-800-273-8255,"
I've been on the low
I been taking my time
I feel like I'm out of my mind
It feel like my life ain't mine
(Who can relate? Woo!)
I've been on the low
I been taking my time
I feel like I'm out of my mind
It feel like my life ain't mine


I don't wanna be alive
I don't wanna be alive
I just wanna die today
I just wanna die
I don't wanna be alive
I don't wanna be alive
I just wanna die
And let me tell you why


All this other shit I'm talkin' 'bout they think they know it
I've been praying for somebody to save me, no one's heroic
And my life don't even matter, I know it, I know it
I know I'm hurting deep down but can't show it
I never had a place to call my own
I never had a home, ain't nobody callin' my phone
Where you been? Where you at? What's on your mind?
They say every life precious but nobody care about mine


I've been on the low
I been taking my time
I feel like I'm out of my mind
It feel like my life ain't mine
(Who can relate? Woo!)
I've been on the low
I been taking my time
I feel like I'm out of my mind
It feel like my life ain't mine


I want you to be alive
I want you to be alive
You don't gotta die today
You don't gotta die
I want you to be alive
I want you to be alive
You don't gotta die
Now lemme tell you why


It's the very first breath
When your head's been drowning underwater
And it's the lightness in the air
When you're there
Chest to chest with a lover
It's holding on, though the road's long
And seeing light in the darkest things
And when you stare at your reflection
Finally knowing who it is
I know that you'll thank God you did


I know where you been, where you are, where you goin'
I know you're the reason I believe in life
What's the day without a little night?
I'm just tryna shed a little light
It can be hard
It can be so hard
But you gotta live right now
You got everything to give right now


I've been on the low
I been taking my time
I feel like I'm out of my mind
It feel like my life ain't mine
(Who can relate? Woo!)
I've been on the low
I been taking my time
I feel like I'm out of my mind
It feel like my life ain't mine


I finally wanna be alive
I finally wanna be alive
I don't wanna die today
I don't wanna die
I finally wanna be alive
I finally wanna be alive
I don't wanna die
I don't wanna die


Pain don't hurt the same, I know
The lane I travel feels alone
But I'm moving 'til my legs give out
And I see my tears melt in the snow
But I don't wanna cry
I don't wanna cry anymore
I wanna feel alive
I don't even wanna die anymore
Oh I don't wanna
I don't wanna
I don't even wanna die anymore"
340,Ed Sheeran,Perfect,"
I found a love for me
Oh darling, just dive right in and follow my lead
Well, I found a girl, beautiful and sweet
Oh, I never knew you were the someone waiting for me
'Cause we were just kids when we fell in love
Not knowing what it was
I will not give you up this time
But darling, just kiss me slow, your heart is all I own
And in your eyes, you're holding mine


Baby, I'm dancing in the dark with you between my arms
Barefoot on the grass, listening to our favourite song
When you said you looked a mess, I whispered underneath my breath
But you heard it, darling, you look perfect tonight


Well I found a woman, stronger than anyone I know
She shares my dreams, I hope that someday I'll share her home
I found a love, to carry more than just my secrets
To carry love, to carry children of our own
We are still kids, but we're so in love
Fighting against all odds
I know we'll be alright this time
Darling, just hold my hand
Be my girl, I'll be your man
I see my future in your eyes


Baby, I'm dancing in the dark, with you between my arms
Barefoot on the grass, listening to our favorite song
When I saw you in that dress, looking so beautiful
I don't deserve this, darling, you look perfect tonight




Baby, I'm dancing in the dark, with you between my arms
Barefoot on the grass, listening to our favorite song
I have faith in what I see
Now I know I have met an angel in person
And she looks perfect
I don't deserve this
You look perfect tonight"
341,Dua Lipa,New Rules,"
One, one, one, one, one


Talkin' in my sleep at night, makin' myself crazy
(Out of my mind, out of my mind)
Wrote it down and read it out, hopin' it would save me
(Too many times, too many times)


My love, he makes me feel like nobody else, nobody else
But my love, he doesn't love me, so I tell myself, I tell myself


One: Don't pick up the phone
You know he's only callin' 'cause he's drunk and alone
Two: Don't let him in
You'll have to kick him out again
Three: Don't be his friend
You know you're gonna wake up in his bed in the morning
And if you're under him, you ain't gettin' over him


I got new rules, I count 'em
I got new rules, I count 'em
I gotta tell them to myself
I got new rules, I count 'em
I gotta tell them to myself


I keep pushin' forwards, but he keeps pullin' me backwards
(Nowhere to turn, no way)
(Nowhere to turn, no)
Now I'm standin' back from it, I finally see the pattern
(I never learn, I never learn)


But my love, he doesn't love me, so I tell myself, I tell myself
I do, I do, I do


One: Don't pick up the phone
You know he's only callin' 'cause he's drunk and alone
Two: Don't let him in
You'll have to kick him out again
Three: Don't be his friend
You know you're gonna wake up in his bed in the morning
And if you're under him, you ain't gettin' over him


I got new rules, I count 'em
I got new rules, I count 'em
I gotta tell them to myself
I got new rules, I count 'em
I gotta tell them to myself


Practice makes perfect
I'm still tryna learn it by heart (I got new rules, I count 'em)
Eat, sleep, and breathe it
Rehearse and repeat it, 'cause I (I got new)


One: Don't pick up the phone (yeah)
You know he's only callin' 'cause he's drunk and alone (alone)
Two: Don't let him in (uh-ooh)
You'll have to kick him out again (again)
Three: Don't be his friend
You know you're gonna wake up in his bed in the morning
And if you're under him, you ain't gettin' over him


I got new rules, I count 'em
I got new rules, I count 'em
(Whoa-ooh, whoa-ooh, whoa)
I gotta tell them to myself
I got new rules, I count 'em
(Baby, you know I count 'em)
I gotta tell them to myself


Don't let him in, don't let him in
Don't, don't, don't, don't
Don't be his friend, don't be his friend
Don't, don't, don't, don't
Don't let him in, don't let him in
Don't, don't, don't, don't
Don't be his friend, don't be his friend
Don't, don't, don't, don't
You're gettin' over him"
342,Katy Perry & Skip Marley,Chained To The Rhythm,"
Are we crazy?
Living our lives through a lens
Trapped in our white picket fence
Like ornaments
So comfortable, we're living in a bubble, bubble
So comfortable, we cannot see the trouble, trouble
Aren't you lonely
Up there in utopia
Where nothing will ever be enough?
Happily numb
So comfortable, we're living in a bubble, bubble
So comfortable, we cannot see the trouble, trouble


So put your rose-colored glasses on
And party on


Turn it up, it's your favorite song
Dance, dance, dance to the distortion
Come on, turn it up, keep it on repeat
Stumbling around like a wasted zombie
Yeah, we think we're free
Drink, this one is on me
We're all chained to the rhythm
To the rhythm
To the rhythm
Turn it up, it's your favorite song
Dance, dance, dance to the distortion
Come on, turn it up, keep it on repeat
Stumbling around like a wasted zombie
Yeah, we think we're free
Drink, this one is on me
We're all chained to the rhythm
To the rhythm
To the rhythm


Are we tone deaf?
Keep sweeping it under the mat
Thought we could do better than that
I hope we can
So comfortable, we're living in a bubble, bubble
So comfortable, we cannot see the trouble, trouble


So put your rose-colored glasses on
And party on


Turn it up, it's your favorite song
Dance, dance, dance to the distortion
Come on, turn it up, keep it on repeat
Stumbling around like a wasted zombie
Yeah, we think we're free
Drink, this one is on me
We're all chained to the rhythm
To the rhythm
To the rhythm
Turn it up, it's your favorite song
Dance, dance, dance to the distortion
Come on, turn it up, keep it on repeat
Stumbling around like a wasted zombie
Yeah, we think we're free
Drink, this one is on me
We're all chained to the rhythm
To the rhythm
To the rhythm


It is my desire
Break down the walls to connect, inspire
Ay, up in your high place, liars
Time is ticking for the empire
The truth they feed is feeble
As so many times before
They greed over the people
They stumbling and fumbling
And we're about to riot
They woke up, they woke up the lions
(Woo!)


Turn it up, it's your favorite song
Dance, dance, dance to the distortion
Come on, turn it up, keep it on repeat
Stumbling around like a wasted zombie
Yeah, we think we're free
Drink, this one is on me
We're all chained to the rhythm
To the rhythm
To the rhythm


Turn it up
Turn it up
It goes on, and on, and on
It goes on, and on, and on
It goes on, and on, and on
'Cause we're all chained to the rhythm"
343,Childish Gambino,Redbone,"
Daylight
I wake up feeling like you won't play right
I used to know, but now that shit don't feel right
It made me put away my pride
So long
You made a nigga wait for some, so long
You make it hard for boy like that to go on
I'm wishing I could make this mine, oh


If you want it, yeah
You can have it, oh, oh, oh
If you need it, ooh
We can make it, oh
If you want it
You can have it


But stay woke
Niggas creepin'
They gon' find you
Gon' catch you sleepin' (Ooh)
Now stay woke
Niggas creepin'
Now don't you close your eyes


Too late
You wanna make it right, but now it's too late
My peanut butter chocolate cake with Kool-Aid
I'm trying not to waste my time


If you want it, oh
You can have it, you can have it
If you need it
You better believe in something
We can make it
If you want it
You can have it, ah!


But stay woke (Stay woke!)
Niggas creepin' (They be creepin')
They gon' find you (They gon' find you)
Gon' catch you sleepin' (Gon' catch you sleepin', put your hands up now, baby)
Ooh, now stay woke
Niggas creepin'
Now, don't you close your eyes
But stay woke, ooh
Niggas creepin' (They gon' find you!)
They gon' find you
Gon' catch you sleepin', ooh
Now stay woke
Niggas creepin'
Now, don't you close your eyes


How'd it get so scandalous?
How'd it get so scandalous?
(Oh, oh, baby you, how'd it get...)
How'd it get so scandalous?
How'd it get so scandalous?
But stay woke
But stay woke"
344,Khalid,Location,"
Send me your location, let's
Focus on communicating
'Cause I just need the time and place to come through (place to come through)
Send me your location
Let's ride the vibrations
I don't need nothing else but you


At times I wonder why I fool with you
But this is new to me, this is new to you
Initially, I didn't wanna fall for you
Gather my attention it was all for you, so don't
Take advantage, don't leave my heart damaged
To understand that things go a little bit better when you plan it... oh


Send me your location, let's
Focus on communicating
'Cause I just need the time and place to come through (place to come through)
Send me your location
Let's ride the vibrations
I don't need nothing else but you


I don't wanna fall in love off of subtweets, so
Let's get personal
I got a lot of cool spots that we can go
Tell me what's the move and I got you
I'm only acting like this 'cause I like you
Just give me the vibe to slide then
Oh, I might make you mine by the night, and


Send me your location, let's
Focus on communicating
'Cause I just need the time and place to come through (place to come through)
Send me your location
Let's ride the vibrations
I don't need nothing else but you


Ride, ride, ride, come and vibe with me tonight
I don't need nothing else but you
(I don't need nothing else but you)
Ride, ride, ride, come and vibe with me tonight
I don't need nothing else but you
Nothing else but you
Do, do, do, do, do, do
Oh, oh, mmm, mmm, mmm, mmm
Oh, oh, oh
Oh, oh, oh, mmm, mmm, mmm
Do, do, do, do, do, do, do
Do, do, do, do, do, do, do
I don't need nothing else but you"
345,Ed Sheeran,Galway Girl,"
She played the fiddle in an Irish band
But she fell in love with an English man
Kissed her on the neck and then I took her by the hand
Said, ""Baby, I just want to dance""


I met her on Grafton street right outside of the bar
She shared a cigarette with me while her brother played the guitar
She asked me what does it mean, the Gaelic ink on your arm?
Said it was one of my friend's songs, do you want to drink on?
She took Jamie as a chaser, Jack for the fun
She got Arthur on the table with Johnny riding a shotgun
Chatted some more, one more drink at the bar
Then put Van on the jukebox, got up to dance


You know, she played the fiddle in an Irish band
But she fell in love with an English man
Kissed her on the neck and then I took her by the hand
Said, ""Baby, I just want to dance""
With my pretty little Galway Girl
You're my pretty little Galway Girl


You know she beat me at darts and then she beat me at pool
And then she kissed me like there was nobody else in the room
As last orders were called was when she stood on the stool
After dancing the céili singing to trad tunes
I never heard Carrickfergus ever sung so sweet
A cappella in the bar using her feet for a beat
Oh, I could have that voice playing on repeat for a week
And in this packed out room swear she was singing to me


You know, she played the fiddle in an Irish band
But she fell in love with an English man
Kissed her on the neck and then I took her by the hand
Said, ""Baby, I just want to dance""
My pretty little Galway Girl
My, my, my, my, my, my, my Galway Girl
My, my, my, my, my, my, my Galway Girl
My, my, my, my, my, my, my Galway Girl


And now we've outstayed our welcome and it's closing time
I was holding her hand, her hand was holding mine
Our coats both smell of smoke, whisky and wine
As we fill up our lungs with the cold air of the night
I walked her home then she took me inside
To finish some Doritos and another bottle of wine
I swear I'm gonna put you in a song that I write
About a Galway Girl and a perfect night


She played the fiddle in an Irish band
But she fell in love with an English man
Kissed her on the neck and then I took her by the hand
Said, ""Baby, I just want to dance""
My pretty little Galway Girl
My, my, my, my, my, my, my Galway Girl
My, my, my, my, my, my, my Galway Girl
My, my, my, my, my, my, my Galway Girl"
