index,artist,song,lyrics
454,The Weeknd & Kendrick Lamar,Pray For Me,"
Ooh, ooh, ooh, ooh


I'm always ready for a war again
Go down that road again
It's all the same
I'm always ready to take a life again
You know I'll ride again
It's all the same (Ooh, ooh, ooh)
Tell me who's gon' save me from myself
When this life is all I know
Tell me who's gon' save me from this hell
Without you, I'm all alone


Who gon' pray for me?
Take my pain for me?
Save my soul for me?
'Cause I'm alone, you see
If I'm gon' die for you
If I'm gon' kill for you
Then I spilled this blood for you, hey


I fight the world, I fight you, I fight myself
I fight God, just tell me how many burdens left
I fight pain and hurricanes, today I wept
I'm tryna fight back tears, flood on my doorsteps
Life a livin' hell, puddles of blood in the streets
Shooters on top of the building, government aid ain't relief
Earthquake, the body dropped, the ground breaks
The poor run with smoke lungs and Scarface
Who need a hero? (Hero)
You need a hero, look in the mirror, there go your hero
Who on the front lines at ground zero? (Hero)
My heart don't skip a beat, even when hard times bumps the needle
Mass destruction and mass corruption
The souls of sufferin' men
Clutchin' on deaf ears again, rapture is comin'
It's all prophecy and if I gotta be sacrificed for the greater good
Then that's what it gotta be


Who gon' pray for me?
Take my pain for me?
Save my soul for me?
'Cause I'm alone, you see
If I'm gon' die for you
If I'm gon' kill for you
Then I spilled this blood for you, hey


Hey, hey, hey, hey
Hey, hey, hey, hey


Who gon' pray for me?
Take my pain for me?
Save my soul for me?
'Cause I'm alone, you see
If I'm gon' die for you
If I'm gon' kill for you
Then I spilled this blood for you, hey


Just in case my faith go, I'll live by my own law
I'll live by my own law, I'll live by my own
Just in case my faith go, I'll live by my own law
I'll live by my own law, I'll live by my own"
455,Lauy,I Like Me Better,"
To be young and in love in New York City
To not know who I am but still know that I'm good long as you're here with me
To be drunk and in love in New York City
Midnight into morning coffee, burning through the hours talking
Damn


I like me better when I'm with you
I like me better when I'm with you
I knew from the first time, I'd stay for a long time, 'cause
I like me better when, I like me better when I'm with you


I don't know what it is but I got that feeling
Waking up in this bed next to you swear the room, yeah, it got no ceiling
If we lay, let the day just pass us by
I might get to too much talking, I might have to tell you something
Damn


I like me better when I'm with you
I like me better when I'm with you
I knew from the first time, I'd stay for a long time, 'cause
I like me better when, I like me better when I'm with you


Stay awhile, stay awhile
Stay here with me
Stay awhile, stay awhile, oh
Stay awhile, stay awhile
Stay here with me
Lay here with me, ooh


I like me better when I'm with you (yes I do, yes I do, babe)
I like me better when I'm with you (oooh noo)
I knew from the first time, I'd stay for a long time, 'cause
I like me better when, I like me better when I'm with you


(I like me, I like me)
(Look who you made me, made me, oh noo)
Better when
I like me better when I'm with you"
456,Imagine Dragons,Thunder,"
Just a young gun with a quick fuse
I was uptight, wanna let loose
I was dreaming of bigger things
And wanna leave my own life behind
Not a ""Yes, sir,"" not a follower
Fit the box, fit the mold
Have a seat in the foyer, take a number
I was lightning before the thunder


Thunder, thunder
Thunder, thun-
Thunder, th-th-thunder, thunder
Thunder, thunder, thun-
Thunder, th-th-thunder, thunder


Thunder, feel the thunder (Thunder, thunder, thun-)
Lightning and the thunder (Thunder, th-th-thunder, thunder)
Thunder, feel the thunder (Thunder, thunder, thun-, thun-)
Lightning and the thunder, thunder, thunder (Th-th-thunder)
Thunder (Thun-, thun-)


Kids were laughing in my classes
While I was scheming for the masses
Who do you think you are?
Dreaming 'bout being a big star
They say, ""You're basic,"" they say, ""You're easy""
You're always riding in the backseat
Now I'm smiling from the stage
While you were clapping in the nosebleeds


Thunder, thunder
Thunder, thun-
Thunder, th-th-thunder, thunder
Thunder, thunder, thun-
Thunder, th-th-thunder, thunder


Thunder, feel the thunder (Thunder, thunder, thun-)
Lightning and the thunder (Thunder, th-th-thunder, thunder)
Thunder, feel the thunder (Thunder, thunder, thun-, thun-)
Lightning and the thunder, thunder, thunder (Th-th-thunder)
Thunder (Thun-, thun-)


Thunder, feel the thunder
Lightning then the thunder, thunder


Thunder, feel the thunder (Thunder, thunder, thun-)
Lightning then the thunder, thunder (Thunder, th-th-thunder, thunder)
Thunder, feel the thunder (Thunder, thunder, thun-, thun-)
Lightning then the thunder, thunder (Th-th-thunder)
Thunder, feel the thunder (Thunder, thunder, thun-)
(Never give up, never give up)
Lightning then the thunder, thunder (Thunder, th-th-thunder, thunder)
(Never give up on your dreams)
Thunder, feel the thunder (Thunder, thunder, thun-, thun-)
(Never give up, never give up)
Lightning then the thunder, thunder (Th-th-thunder)
(Never give up on your dreams)


Thunder, thunder, thun-
Thunder, th-th-thunder, thunder
Thunder, thunder, thun-
Thunder, th-th-thunder, thunder
(Woah-oh-ohh)
Thunder, thunder, thun-
Thunder, th-th-thunder, thunder
(Woah-oh-ohh)
Thunder, thunder, thun-
Thunder, th-th-thunder, thunder"
457,Justin Timberlake & Chris Stapleton,Say Something,"
Mhmm, yeah, alright
Ooh


Everyone knows all about my direction
And in my heart somewhere I wanna go there
Still, I don't go there


Everybody says, ""say something that says something”
“Say something that says something”
“Say something that says something”
I don't wanna get caught, up in the rhythm of it
But I can't help myself, no, I can't help myself, no, no
Caught up in the middle of it
No, I can't help myself, no I can't help myself, no, no, no
Caught up in the rhythm of it


Maybe I'm looking for something I can't have (Maybe I'm looking for something I can't have)
Maybe I'm looking for something I can't have


Everyone knows all about my transgressions
Still in my heart somewhere, there's melody and harmony
For you and me, tonight (whoa)
I hear them call my name


Everybody says, ""Say something""
Then, ""Say something, say something""
Then, ""Say something, say something""
Then, ""Say something""
I don't want to get caught up in the rhythm of it
But I can't get help myself, no I can't help myself, no, no
Caught up in the middle of it
No, I can't help myself, no I can't help myself, no, no, no
Caught up in the rhythm of it


Maybe I'm looking for something I can't have (Maybe I'm looking for something I can't have)
Maybe I'm looking for something I can't have (Maybe I'm looking for something I can't have)
Maybe I'm looking for something I can't have (Maybe I'm looking for something I can't have)
Maybe I'm looking for something I can't have (Maybe I'm looking for something I can't have)


Sometimes, the greatest way to say something is to say nothing at all
Sometimes, the greatest way to say something is to say nothing at all
Sometimes, the greatest way to say something is to say nothing


But I can't help myself, no I can't help myself, no, no
Caught up in the middle of it
No, I can't help myself, no I can't help myself, no, no, no
Caught up in the rhythm of it


Maybe I'm looking for something I can't have (Maybe I'm looking for something I can't have)
Maybe I'm looking for something I can't have (Maybe I'm looking for something I can't have)
Maybe I'm looking for something I can't have (Maybe I'm looking for something I can't have)
Maybe I'm looking for something I can't have (Maybe I'm looking for something I can't have)


Sometimes the greatest way to say something is to say nothing at all
Sometimes the greatest way to say something is to say nothing at all
Sometimes the greatest way to say something is to say nothing"
458,Dan & Shay,Tequila,"
I can still shut down a party
I can hang with anybody
I can drink whiskey and red wine
Champagne all night
Little Scotch on the rocks and I'm fine, I'm fine


But when I taste tequila
Baby, I still see ya
Cuttin' up the floor in a sorority T-shirt
The same one you wore when we were
Sky high in Colorado, your lips pressed against the bottle
Swearing on a Bible, baby, I'd never leave ya
I remember how bad I need ya
When I taste tequila (When I, when I, when I)
When I taste tequila (When I, when I, when I)


I can kiss somebody brand new
And not even think about you
I can show up to the same bar
Hear the same songs in my car
Baby, your memory, it only hits me this hard


When I taste tequila
Baby, I still see ya
Cuttin' up the floor in a sorority T-shirt
The same one you wore when we were
Sky high in Colorado, your lips pressed against the bottle
Swearing on a Bible, baby, I'd never leave ya
I remember how bad I need ya (Need ya)
When I taste tequila (When I, when I, when I)
When I taste tequila, oh (When I, when I, when I)


I ain't even drunk, I ain't even drunk and I'm thinkin'
How I need your love, how I need your love, yeah, it sinks in


When I taste tequila
Baby, I still see ya
Sorority T-shirt
The same one you wore when we were
Sky high in Colorado, your lips pressed against the bottle
Swearing on a Bible, baby, I'd never leave ya
I remember how bad I need ya (Need ya)
When I taste tequila (When I, when I, when I)
When I taste tequila, oh (When I, when I, when I)
When I taste tequila, oh (When I, when I, when I)
When I taste tequila (When I, when I, when I)
Ooh"
459,Drake,Nonstop,"
Tay Keith, fuck these niggas up!


Look, I just flipped a switch (Flipped, flipped)
I don't know nobody else that's doin' this
Bodies start to drop, ayy (Hit the floor)
Now they wanna know me since I hit the top, ayy
This a Rollie, not a stopwatch, shit don't ever stop
This the flow that got the block hot, shit got super hot, ayy
Give me my respect (Give me my respect)
I just took it left like I'm ambidex'
Bitch, I move through London with the Eurostep (Two)
Got a sneaker deal and I ain't break a sweat
Catch me 'cause I'm gone (Outta there, I’m gone)
How I go from 6 to 23 like I'm LeBron?
Servin' up a pack (Servin' up a pack)
Niggas pullin' gimmicks 'cause they scared to rap, ayy
Funny how they shook, ayy, got these niggas shook
Pullin' back the curtain by myself, take a look, ayy
I'm a bar spitta, I’m a hard hitta
Yeah I’m light-skinned, but I'm still a dark nigga
I'm a wig splitta, I'm a tall figure
I'm a unforgivin' wild-ass dog nigga
Somethin' wrong with 'em, got 'em all bitter
I'm a bill printer, I'm a gravedigger
Yeah, I am what I am
I don't have no time for no misunderstandings again


My head is spinnin', from smokin' the chicken, the bass is kickin'
My head is spinnin', from smokin' the chicken, the bass is kickin'
My head is spinnin', from smokin' the chicken, the bass is kickin'
My head is spinnin'
This a Rollie, not a stopwatch, shit don't ever stop
From smokin' the chicken, the bass is kickin'
My head is spinnin', from smokin' the chicken, the bass is kickin'
My head is spinnin', from smokin' the chicken, the bass is kickin'
My head is spinnin', from smokin' the chicken, the bass is kickin'
My head is–


Future took the business and ran it for me
I let Ollie take the owl, told him brand it for me
I get 2 million a pop and that’s standard for me
Like I went blind, dog, you gotta hand it to me
(Gotta gimme that shit, dog)
Prayed, then I prayed again (Amen, Lord)
Had a moment but it came and went
(They don't love you no more)
You don’t wanna play with him (Nah, nah, nah)
They’ll be mournin' you like 8AM (R.I.P.)
Pinky ring 'til I get a wedding ring (Whoa, yeah)
Love my brothers, cut 'em in on anything (Big slice)
And you know it's King Slime Drizzy, damn (Woo yeah)
She just said I'm bae, I hit the thizzle dance (Mac Dre shit)
Either hand is the upper hand (Oh yeah, shit)
Got a bubba on my other hand (Whoa, yeah, shit, yeah)
This shit ain't no hundred bands (Nah, nah, nah, nah)
Palace look like Buckingham
Bills so big, I call 'em Williams, for real
Reasons to go crazy, got a trillion, for real
They been tryin' me but I'm resilient, for real
I can’t go in public like civilian, for real
And I hardly take offense
Money for revenge, man, that’s hardly an expense
Al Haymon checks off of all of my events
I like all the profit, man, I hardly do percents (I don't do that shit)
A big part of me resents
Niggas that I knew from when I started in this shit
They see what I got and, man, it's hard to be content
Fuck what they got goin' on, I gotta represent (Ayy!)


My head is spinnin', from smokin' the chicken, the bass is kickin'
My head is spinnin', from smokin' the chicken, the bass is kickin'
My head is spinnin', from smokin' the chicken, the bass is kickin'
My head is spinnin'
This a Rollie, not a stopwatch, shit don't ever stop
From smokin' the chicken, the bass is kickin'
My head is spinnin', from smokin' the chicken, the bass is kickin'
My head is spinnin', from smokin' the chicken, the bass is kickin'
My head is spinnin'
This the flow that got the block hot, shit got super hot"
460,David Guetta & Sia,Flames,"
Oh, oh


One foot in front of the other babe
One breath leads to another, yeah
Just keep moving, oh
Look within for the strength today
Listen out for the voice to say
Just keep moving, oh


Go, go, go
Figure it out, figure it out, but don't stop moving
Go, go, go
Figure it out, figure it out, you can do this


So my love, keep on running
You gotta get through today
There my love, keep on running
Gotta keep those tears at bay
Oh, my love, don't stop burning
Gonna send them up in flames
In flames


Don't stop, tomorrow's another day
Don't stop, tomorrow you'll feel no pain
Just keep moving
Don't stop the past'll trip you up
You know, right now's gotta be enough
Just keep moving


Go, go, go
Figure it out, figure it out, but don't stop moving
Go, go, go
Figure it out, figure it out, you can do this


So my love, keep on running
You gotta get through today
There my love, keep on running
Gotta keep those tears at bay
Oh, my love, don't stop burning
Gonna send them up in flames
In flames


In flames
In flames
Go, go, go
Figure it out, figure it out, but don't stop moving
Go, go, go
Figure it out, figure it out, you can do this


So my love, keep on running
You gotta get through today
Then my love, keep on running
Gotta keep those tears at bay
Oh, my love, don't stop burning
Gonna send them up in flames
In flames"
461,"DJ Snake, Selena Gomez, Ozuna & Cardi B",Taki Taki,"


Wo-oh, oh-oh


Báilame como si fuera la última vez (Oh)
Y enséñame ese pasito que no sé (Yeah-yeah)
Un besito bien suavecito, bebé
Taki taki, taki taki, ¡rumba!
Wo-oh, oh-oh
Hi Music Hi Flow (Snake; jaja)
Báilame como si fuera la última vez (Oh-oh)
Y enséñame ese pasito que no sé (Oh-oh)
Un besito bien suavecito, bebé
Taki taki (Oh-oh)
Taki taki (Yeah-yeah)


Taki taki, quiere un besito o un ñaqui
Booty explota como Nagasaki (-aki)
Prende los motores Kawasaki (Kawasaki)
Que la disco está llena y llegaron los Anunnakis (Eh-eh)
No le bajes, el booty sobresale de tu traje
No trajo pantisito pa' que el nene no trabaje
Es que yo me sé lo que ella cree que ella se sabe
Cuenta que no quiere pero me tiene espionaje, eh-eh
El booty sobresale de tu traje
No trajo pantisito pa’ que el nene no trabaje
Es que yo me sé lo que ella cree que ella se sabe
Cuenta que no quiere pero me tiene espionaje, eh-eh


Báilame como si fuera la última vez
Y enséñame ese pasito que no sé
Un besito bien suavecito, bebé
Taki taki, taki taki, ¡rumba!
Wo-oh, oh-oh
Hi Music Hi Flow


Bardi (Cardi)
He said he wanna to touch it, and tease it, and squeeze it
Well, my piggy bank is hungry, my nigga, you need to feed it
If the text ain't freaky, I don't wanna read it
And just to let you know, this punani is undefeated, ayy
He said he really wanna see me more
I said, ""We should have a date—where? At the Lamborghini store""
I’m kinda scary, hard to read, I'm like a Ouija board
But I'm a boss bitch, who you gonna leave me for?
You hoes got no class, you bitches is broke still
I be talking cash, shit, while I'm popping my gold grill
I'm a whole rich bitch, and I work like I'm broke still
But the love be so fake, but the hate be so real, uh


El booty sobresale de mi traje
No traje pantisito pa' que el nene no trabaje
Es que yo me sé lo que tú cree' que tú no sabe’
Dice que no quiere, pero se quiere comer el equipaje


Báilame como si fuera la última vez
Y enséñame ese pasito que no sé
Un besito bien suavecito, bebé
Taki taki, taki taki, ¡rumba!
Wo-oh, oh-oh (DJ Snake)


Careful when you come through my way
My body already know how to play
Work it, keep it tight everyday
And I, I, I know you need a taste
When I ooh, you’re fallin' in love
Give a little ooh-ooh, get it well done
Dancing on my ooh, make your girl wanna run
We keep moving ’til the sun come up
Porque I am the party, yo soy fiesta
Blow out your candles, then have a siesta
They can try, pero no one can stop me
What my taki taki wants, yeah, my taki taki gets, uh


Báilame como si fuera la última vez
Y enséñame ese pasito que no sé
Un besito bien suavecito, bebé
Taki taki, taki taki, ¡rumba!
Wo-oh, oh-oh
Hi Music Hi Flow
Taki taki
Taki taki"
462,Lady Gaga & Bradley Cooper,Shallow,"
Tell me somethin', girl
Are you happy in this modern world?
Or do you need more?
Is there somethin' else you're searchin' for?


I'm fallin'
In all the good times
I find myself longing for change
And in the bad times, I fear myself


Tell me something, boy
Aren't you tired tryna fill that void?
Or do you need more?
Ain't it hard keepin' it so hardcore?


I'm fallin'
In all the good times
I find myself longing for change
And, in the bad times, I fear myself


I'm off the deep end, watch as I dive in
I'll never meet the ground
Crash through the surface where they can't hurt us
We're far from the shallow now


In the sha-ha, sha-la-low
In the sha-sha-la-la-la-low
In the sha-ha, sha-ha-ha-low
We're far from the shallow now


Hoo, huh, uh, huhh-ow
Huh, huhh-huhhh


I'm off the deep end, watch as I dive in
I'll never meet the ground
Crash through the surface where they can't hurt us
We're far from the shallow now


In the sha-ha, sha-la-low
In the sha-ha, sha-la-la-la-low
In the sha-ha, sha-ha-low
We're far from the shallow now"
463,Tom Walker,Leave A Light On,"
The second someone mentioned you were all alone
I could feel the trouble coursin' through your veins
Now I know it's got a hold
Just a phone call left unanswered had me sparkin' up
These cigarettes won't stop me wonderin' where you are
Don't let go, keep a hold


If you look into the distance, there's a house upon the hill
Guidin' like a lighthouse
To a place where you'll be safe to feel our grace
'Cause we've all made mistakes
If you've lost your way


I will leave the light on
I will leave the light on
I will leave the light on
I will leave the light on


Tell me what's been happenin', what's been on your mind
Lately, you've been searchin' for a darker place to hide
That's alright
But if you carry on abusing, you'll be robbed from us
I refuse to lose another friend to drugs
Just come home, don't let go


If you look into the distance, there's a house upon the hill
Guidin' like a lighthouse
To a place where you'll be safe to feel our grace
'Cause we've all made mistakes
If you've lost your way


I will leave the light on
I will leave the light on
I will leave the light on
I will leave the light on
I will leave the light on


If you look into the distance, there's a house upon the hill
Guidin' like a lighthouse
It's a place where you'll be safe to feel our grace
And if you've lost your way, if you've lost your way
I will leave the light on
And I know you're down and out now, but I need you to be brave
Hidin' from the truth ain't gonna make this all okay
I see your pain
If you don't feel our grace and you've lost your way


Well, I will leave the light on
I will leave the light on
'Cause I will leave the light on"
464,Selena Gomez & Marshmello,Wolves,"
In your eyes, there's a heavy blue
One to love, and one to lose
Sweet divine, a heavy truth
Water or wine, don't make me choose


I wanna feel the way that we did that summer night, night
Drunk on a feeling, alone with the stars in the sky


I've been running through the jungle
I've been running with the wolves
To get to you, to get to you
I've been down the darkest alleys
Saw the dark side of the moon
To get to you, to get to you
I've looked for love in every stranger
Took too much to ease the anger
All for you, yeah, all for you
I've been running through the jungle
I've been crying with the wolves
To get to you, to get to you, to get to you


To get to you
To get to you


Your fingertips trace my skin
To places I have never been
Blindly, I am following
Break down these walls and come on in


I wanna feel the way that we did that summer night, night
Drunk on a feeling, alone with the stars in the sky


I've been running through the jungle
I've been running with the wolves
To get to you, to get to you
I've been down the darkest alleys
Saw the dark side of the moon
To get to you, to get to you
I've looked for love in every stranger
Took too much to ease the anger
All for you, yeah, all for you
I've been running through the jungle
I've been crying with the wolves
To get to you, to get to you, to get to you


To get to you
To get to you


I've been running through the jungle
I've been running with the wolves
To get to you, to get to you
I've been down the darkest alleys
Saw the dark side of the moon
To get to you, to get to you
I've looked for love in every stranger
Took too much to ease the anger
All for you, yeah, all for you
I've been running through the jungle
I've been crying with the wolves
To get to you, to get to you, to get to you"
